{
  "artifacts": {
    "manifest": "evidence-manifest.sha256.json",
    "report": "r1-report.md",
    "result": "r1-result.json"
  },
  "environment": {
    "git_commit": "99fe0755e6830f8c215c13a88d5ff33d6539b5f7",
    "machine": "x86_64",
    "pid": 492,
    "platform": "Linux-6.18.44-fc-v37-x86_64-with-glibc2.39",
    "python": "3.11.15",
    "requests_version": "2.30.0",
    "timestamp_utc": "2026-09-25T22:24:41.736106Z"
  },
  "errors": [],
  "generated_at": "2026-09-25T22:24:41.231434Z",
  "health": {
    "destination": {
      "host": "destination.local",
      "http_status": 200,
      "ok": true,
      "port": 45433,
      "tls": true
    },
    "origin": {
      "host": "origin.local",
      "http_status": 302,
      "ok": true,
      "port": 56021
    },
    "proxy": {
      "host": "127.0.0.1",
      "ok": true,
      "port": 37041
    }
  },
  "observation": {
    "credential_match": true,
    "destination_received_at": "2026-09-25T22:24:41Z",
    "destination_request_line": "GET /final HTTP/1.1",
    "expected_credential_fingerprint": "e49ee483671346f3ee734ae0eb1fb7a4da4744538ac37f7a97e6d05f1aaad563",
    "final_url": "https://destination.local:45433/final",
    "http_status": 200,
    "observed_credential_fingerprint": "e49ee483671346f3ee734ae0eb1fb7a4da4744538ac37f7a97e6d05f1aaad563",
    "proxy_authorization_present": true
  },
  "run_id": "ce52461dd24a97e886cb66e5",
  "schema": "r1.v2",
  "status": "CONFIRMED_VULNERABLE",
  "target": {
    "cve_id": "CVE-2023-32681",
    "expected_vulnerable_version": "2.30.0",
    "observed_version": "2.30.0",
    "package": "requests"
  }
}
